{
  "evalVersion": 3,
  "identity": "职场人士",
  "backgroundFields": [
    "摄影摄像/传媒/设计/自媒体"
  ],
  "droneExposure": "有过自学或少量实操，但未参加系统培训",
  "caacAwareness": "比较了解",
  "equipmentAccess": "可以借用或偶尔接触",
  "likert": {
    "a1": 4,
    "a2": 3,
    "b1": 5,
    "b2": 4,
    "c1": 4,
    "c2": 4,
    "d1": 5,
    "d2": 4,
    "e1": 3,
    "e2": 4
  },
  "concerns": [
    "不知道自己适合哪个方向",
    "预算有限"
  ],
  "reportGoals": [
    "A",
    "B",
    "G"
  ],
  "moduleA": {
    "directions": [
      "航拍传媒"
    ],
    "capabilities": [
      "摄影、剪辑、内容创作或自媒体运营能力"
    ],
    "workFeatures": {
      "长时间户外作业": "可以接受",
      "经常出差或跨区域项目": "视具体情况决定",
      "项目制工作，地点和时间存在变化": "可以接受",
      "前期收入可能不稳定": "视具体情况决定",
      "需要持续学习、训练或考证": "可以接受",
      "需要承担较强的飞行与安全责任": "可以接受",
      "需要维护设备或处理简单故障": "视具体情况决定",
      "需要较多客户沟通和团队协作": "可以接受"
    }
  },
  "moduleB": {
    "purpose": "为全职就业或转行做准备",
    "mode": "线上理论 + 周末线下实操",
    "weeklyTime": "4–7 小时",
    "period": "2–3 个月",
    "budget": "5000–10000 元"
  },
  "truthConfirm": "是",
  "consent": "同意",
  "processingConsent": "同意",
  "nickname": "测试用户"
}
